no,vsn,model,created_on,modified_on,source_term_id,source_vsn,status,item_ua,item_en,item_code,manual,term_short_ua,term_short_en,term_desc
1,1.0,ReleaseCharacteristics,2023-10-12T15:57:05.191,2024-09-23T09:35:32.074,200000002077,78,1,Уповільнене,Delayed,ua_42_1,false,null,null,Вивільнення речовин(и) пізніше, ніж воно відбувалося б у препарата зі звичайним вивільненням, що досягається за допомогою розробки спеціальної рецептури та/або методу виробництва; кишковорозчинні та інші гастрорезистентні препарати включені.
2,1.0,ReleaseCharacteristics,2023-10-12T15:57:05.193,2024-09-23T09:35:32.136,200000002078,78,1,Пролонговане,Prolonged,ua_42_2,false,null,null,Вивільнення речовин(и) протягом більш тривалого періоду, ніж воно відбувалося б у препарата із звичайним вивільненням, що досягається за допомогою розробки спеціальної рецептури та/або методу виробництва
3,1.0,ReleaseCharacteristics,2023-10-12T15:57:05.195,2024-09-23T09:35:32.139,200000002079,78,1,Модифіковане,Modified,ua_42_3,false,null,null,Вивільнення речовин(и) у спосіб, що відрізняється від того, яке відбувалося б у препарату із звичайним вивільненням, яке досягається за допомогою розробки спеціальної рецептури та/або методу виробництва, але який не класифікується як уповільнене вивільнення або пролонговане -вивільнення; включені препарати із пульсуючим вивільненням.
4,1.0,ReleaseCharacteristics,2023-10-12T15:57:05.196,2024-09-23T09:35:32.142,200000002080,78,1,Звичайне,Conventional,ua_42_4,false,null,null,Вивільнення речовин(и) у спосіб, який навмисно не модифіковано розробкою спеціальної рецептери та/або методом виробництва
5,1.0,ReleaseCharacteristics,2023-10-12T15:57:05.197,2024-09-23T09:35:32.144,200000002081,78,1,Невідоме,Unknown,ua_42_5,false,null,null,Вивільнення речовин(и) невідомим або невказаним способом.
