no,atc,atc_parent,vsn,model,created_on,modified_on,source_term_id,source_vsn,status,item_ua,item_en,item_code,manual,term_short_ua,term_short_en,term_desc
"63","null","null","1.0","RoutesAndMethodsOfAdministration","2023-10-10T20:55:59.145","2024-09-20T17:44:30.037","100000073614","85","1","Ларингофарингеальне застосування","Laryngopharyngeal use","ua_43_63","false",null,null,"Введення лікарського засобу в гортаноглотку для місцевої дії (анестетики)."
"64","null","null","1.0","RoutesAndMethodsOfAdministration","2023-10-10T20:55:59.149","2024-09-20T17:44:30.039","100000073615","86","1","Назальне застосування","Nasal use","ua_43_64","false",null,null,"Введення лікарського засобу в ніс для отримання системної або місцевої дії. Виключається інгаляційна терапія, призначена для нижніх дихальних шляхів; дивіться інгаляційне застосування."
"65","null","null","1.0","RoutesAndMethodsOfAdministration","2023-10-10T20:55:59.153","2024-09-20T17:44:30.042","100000073616","89","1","Небулізаційне застосування (застосування для небулізації)","Nebulisation use","ua_43_65","false",null,null,"Введення ветеринарного лікарського засобу, перетвореного в аерозоль для масового лікування, наприклад, птахів."
"66","null","null","1.0","RoutesAndMethodsOfAdministration","2023-10-10T20:55:59.156","2024-09-20T17:44:30.045","100000073617","90","1","Очне застосування","Ocular use","ua_43_66","false",null,null,"Нанесення лікарського засобу на очне яблуко та/або кон'юнктиву."
"67","null","null","1.0","RoutesAndMethodsOfAdministration","2023-10-10T20:55:59.160","2024-09-20T17:44:30.048","100000073618","88","1","Окулоназальне застосування (офтальмологічно-назальне застосування)","Oculonasal use","ua_43_67","false",null,null,"Введення ветеринарного лікарського засобу шляхом інстиляції (закапування) в очі та ніздрі окремих тварин (зазвичай птахів) або розпилення на тварин для досягнення такого ж ефекту."
"68","null","null","1.0","RoutesAndMethodsOfAdministration","2023-10-10T20:55:59.163","2024-09-20T17:44:30.050","100000073619","89","1","Оральне застосування","Oral use","ua_43_68","false",null,null,"Застосування лікарського засобу шляхом ковтання."
"69","null","null","1.0","RoutesAndMethodsOfAdministration","2023-10-10T20:55:59.166","2024-09-20T17:44:30.053","100000073620","87","1","Оромукозне застосування","Oromucosal use","ua_43_69","false",null,null,"Введення лікарського засобу в ротову порожнину для отримання системної або місцевої дії. Термін`оромукозний` використовується лише тоді, коли більш специфічний термін (наприклад, щічний, ясенний, під’язиковий...) не застосовується. Пероральне застосування виключено."
"70","null","null","1.0","RoutesAndMethodsOfAdministration","2023-10-10T20:55:59.168","2024-09-20T17:44:30.056","100000073621","85","1","Орофарингеальне застосування (ротоглоткове застосування)","Oropharyngeal use","ua_43_70","false",null,null,"Введення лікарського засобу в ротоглотку (горло) для отримання місцевого ефекту."
"71","null","null","1.0","RoutesAndMethodsOfAdministration","2023-10-10T20:55:59.171","2024-09-20T17:44:30.058","100000073622","89","1","Паравертебральне застосування","Paravertebral use","ua_43_71","false",null,null,"Ін'єкція ветеринарного лікарського засобу вздовж хребта тварин."
"72","null","null","1.0","RoutesAndMethodsOfAdministration","2023-10-10T20:55:59.173","2024-09-20T17:44:30.061","100000073623","86","1","Періартикулярне застосування (навколосуглобове застосування)","Periarticular use","ua_43_72","false",null,null,"Ін'єкція лікарського засобу навколо суглоба."
"73","null","null","1.0","RoutesAndMethodsOfAdministration","2023-10-10T20:55:59.176","2024-09-20T17:44:30.064","100000073624","87","1","Периневральне застосування","Perineural use","ua_43_73","false",null,null,"Ін'єкція лікарського засобу в безпосереднє оточення одного або кількох нервів."
"74","null","null","1.0","RoutesAndMethodsOfAdministration","2023-10-10T20:55:59.179","2024-09-20T17:44:30.066","100000073625","87","1","Періодонтальне застосування","Periodontal use","ua_43_74","false",null,null,"Введення в мішечок між зубом і яснами."
"75","null","null","1.0","RoutesAndMethodsOfAdministration","2023-10-10T20:55:59.181","2024-09-20T17:44:30.069","100000073626","86","1","Заднє юкстасклеральне застосування (Заднє навколосклеральне застосування)","Posterior juxtascleral use","ua_43_75","false",null,null,"Введення лікарського засобу під субтенонову мембрану склери (тобто в епісклеральний простір), що прилягає до макули."
"76","null","null","1.0","RoutesAndMethodsOfAdministration","2023-10-10T20:55:59.183","2024-09-20T17:44:30.072","100000073627","88","1","Введення шляхом наливання","Pour-on use","ua_43_76","false",null,null,"Введення ветеринарного лікарського засобу шляхом наливання на серединну лінію спини тварини або на верхню частину голови та навколо основи рогів."
"77","null","null","1.0","RoutesAndMethodsOfAdministration","2023-10-10T20:55:59.186","2024-09-20T17:44:30.094","100000073628","87","1","Ректальне застосування","Rectal use","ua_43_77","false",null,null,"Введення лікарського засобу в пряму кишку з метою отримання місцевого або системного впливу."
"78","null","null","1.0","RoutesAndMethodsOfAdministration","2023-10-10T20:55:59.188","2024-09-20T17:44:30.098","100000073629","85","1","Шлях введення не застосовується","Route of administration not applicable","ua_43_78","false",null,null,"Стосується лікарських засобів, які не контактують безпосередньо з тілом пацієнта, або вводяться в різні або невизначені анатомічні ділянки."
"79","null","null","1.0","RoutesAndMethodsOfAdministration","2023-10-10T20:55:59.190","2024-09-20T17:44:30.102","100000073630","85","1","Скарифікація шкіри","Skin scarification","ua_43_79","false",null,null,"Введення лікарського засобу шляхом подряпин на шкірі."
"80","null","null","1.0","RoutesAndMethodsOfAdministration","2023-10-10T20:55:59.192","2024-09-20T17:44:30.105","100000073631","86","1","Точне застосування (застосування на невеликій ділянці шкіри)","Spot-on use","ua_43_80","false",null,null,"Введення ветеринарного лікарського засобу в одну ділянку на спині тварини або в основі голови."
"81","null","null","1.0","RoutesAndMethodsOfAdministration","2023-10-10T20:55:59.195","2024-09-20T17:44:30.108","100000073632","85","1","Субкон'юнктивальне застосування","Subconjunctival use","ua_43_81","false",null,null,"Ін'єкція лікарського засобу під кон'юнктиву."
"82","null","null","1.0","RoutesAndMethodsOfAdministration","2023-10-10T20:55:59.197","2024-09-20T17:44:30.111","100000073633","89","1","Підшкірне застосування","Subcutaneous use","ua_43_82","false",null,null,"Ін'єкція лікарського засобу безпосередньо під шкіру, тобто підшкірно"
"83","null","null","1.0","RoutesAndMethodsOfAdministration","2023-10-10T20:55:59.199","2024-09-20T17:44:30.116","100000073634","85","1","Сублінгвальне застосування","Sublingual use","ua_43_83","false",null,null,"Введення лікарського засобу під язик для отримання системної дії."
"84","null","null","1.0","RoutesAndMethodsOfAdministration","2023-10-10T20:55:59.202","2024-09-20T17:44:30.119","100000073635","85","1","Застосування на поверхні соска(ів).","Teat use","ua_43_84","false",null,null,"Введення ветеринарного лікарського засобу на поверхню соска(ів). Занурення соски включено."
"85","null","null","1.0","RoutesAndMethodsOfAdministration","2023-10-10T20:55:59.204","2024-09-20T17:44:30.122","100000073636","86","1","Введення шляхом нанесення на поверхню корму","Top-dressing use","ua_43_85","false",null,null,"Введення ветеринарного лікарського засобу шляхом нанесення на поверхню корму безпосередньо перед годуванням."
"86","null","null","1.0","RoutesAndMethodsOfAdministration","2023-10-10T20:55:59.206","2024-09-20T17:44:30.125","100000073637","84","1","Трансдермальне застосування","Transdermal use","ua_43_86","false",null,null,"Нанесення лікарського засобу на шкіру з метою отримання системної дії після проходження через шкірний бар’єр."
"87","null","null","1.0","RoutesAndMethodsOfAdministration","2023-10-10T20:55:59.208","2024-09-20T17:44:30.128","100000073638","88","1","Уретральне застосування","Urethral use","ua_43_87","false",null,null,"Введення лікарського засобу в уретру."
"88","null","null","1.0","RoutesAndMethodsOfAdministration","2023-10-10T20:55:59.210","2024-09-20T17:44:30.131","100000073639","85","1","Вагінальне застосування","Vaginal use","ua_43_88","false",null,null,"Введення лікарського засобу в піхву."
"89","null","null","1.0","RoutesAndMethodsOfAdministration","2023-10-10T20:55:59.213","2024-09-20T17:44:30.134","100000073640","87","1","Введення ветеринарного лікарського засобу водним (морським або прісноводним) видам шляхом лікування водного середовища.","Water-borne use","ua_43_89","false",null,null,"Введення ветеринарного лікарського засобу водним (морським або прісноводним) видам шляхом лікування водного середовища."
"90","null","null","1.0","RoutesAndMethodsOfAdministration","2023-10-10T20:55:59.216","2024-09-20T17:44:30.137","100000073641","87","1","Застосування методом проколу перетинки крила","Wing-web-stab use","ua_43_90","false",null,null,"Введення ветеринарного лікарського засобу в перетинку крил птаха."
"91","null","null","1.0","RoutesAndMethodsOfAdministration","2023-10-10T20:55:59.219","2024-09-20T17:44:30.139","100000075237","9","3","Застосування у клубовій кишці","Intraileal use","ua_43_91","false",null,null,null
"92","null","null","1.0","RoutesAndMethodsOfAdministration","2023-10-10T20:55:59.221","2024-09-20T17:44:30.142","100000075238","10","3","Внутрішньошлункове застосування","Intragastric use","ua_43_92","false",null,null,null
"93","null","null","1.0","RoutesAndMethodsOfAdministration","2023-10-10T20:55:59.223","2024-09-20T17:44:30.144","100000075239","90","1","Інтраепідермальне застосування","Intraepidermal use","ua_43_93","false",null,null,"Введення лікарського засобу в епідерміс"
"94","null","null","1.0","RoutesAndMethodsOfAdministration","2023-10-10T20:55:59.226","2024-09-20T17:44:30.147","100000075240","8","3","Інтрадуральне застосування (застосування всередині твердої оболонки, на поверхні мозку)","Intradural use","ua_43_94","false",null,null,null
"95","null","null","1.0","RoutesAndMethodsOfAdministration","2023-10-10T20:55:59.228","2024-09-20T17:44:30.150","100000075241","11","3","Інтрадуоденальне застосування","Intraduodenal use","ua_43_95","false",null,null,null
"96","null","null","1.0","RoutesAndMethodsOfAdministration","2023-10-10T20:55:59.231","2024-09-20T17:44:30.152","100000075242","11","3","Інтраназальне застосування","Intranasal use","ua_43_96","false",null,null,null
"97","null","null","1.0","RoutesAndMethodsOfAdministration","2023-10-10T20:55:59.235","2024-09-20T17:44:30.155","100000075243","9","3","Місцеве застосування","Local use","ua_43_97","false",null,null,null
"98","null","null","1.0","RoutesAndMethodsOfAdministration","2023-10-10T20:55:59.238","2024-09-20T17:44:30.157","100000075244","10","3","Не зазначено","Not mentioned","ua_43_98","false",null,null,null
"99","null","null","1.0","RoutesAndMethodsOfAdministration","2023-10-10T20:55:59.241","2024-09-20T17:44:30.160","100000075245","9","3","Застосування in vitro","In vitro use","ua_43_99","false",null,null,null
"100","null","null","1.0","RoutesAndMethodsOfAdministration","2023-10-10T20:55:59.244","2024-09-20T17:44:30.162","100000075246","11","3","Внутрішньочеревне застосування","Intraabdominal use","ua_43_100","false",null,null,null
"101","null","null","1.0","RoutesAndMethodsOfAdministration","2023-10-10T20:55:59.247","2024-09-20T17:44:30.166","100000075247","6","3","Інтерстиційне (інтерстиціанальне) застосування","Interstitial use","ua_43_101","false",null,null,null
"102","null","null","1.0","RoutesAndMethodsOfAdministration","2023-10-10T20:55:59.250","2024-09-20T17:44:30.169","100000075248","92","1","Інфільтрація","Infiltration","ua_43_102","false",null,null,"Спосіб введення, зазвичай ін'єкційний, за допомогою якого рідина потрапляє в тканину-мішень (наприклад, інфільтрація анестетика)"
"103","null","null","1.0","RoutesAndMethodsOfAdministration","2023-10-10T20:55:59.254","2024-09-20T17:44:30.172","100000075249","90","1","Імплантація","Implantation","ua_43_103","false",null,null,"Введення імплантату або еквівалента живої тканини в живу тканину."
"104","null","null","1.0","RoutesAndMethodsOfAdministration","2023-10-10T20:55:59.257","2024-09-20T17:44:30.175","100000075250","9","3","Ентеральне застосування","Enteral use","ua_43_104","false",null,null,null
"105","null","null","1.0","RoutesAndMethodsOfAdministration","2023-10-10T20:55:59.261","2024-09-20T17:44:30.177","100000075251","9","3","Кон'юнктивальне застосування","Conjunctival use","ua_43_105","false",null,null,null
"106","null","null","1.0","RoutesAndMethodsOfAdministration","2023-10-10T20:55:59.265","2024-09-20T17:44:30.180","100000075252","7","3","Трансмукозне застосування","Transmucosal use","ua_43_106","false",null,null,null
"107","null","null","1.0","RoutesAndMethodsOfAdministration","2023-10-10T20:55:59.269","2024-09-20T17:44:30.182","100000075253","7","3","Застосування у м'яких тканинах","Soft tissue use","ua_43_107","false",null,null,null
"108","null","null","1.0","RoutesAndMethodsOfAdministration","2023-10-10T20:55:59.273","2024-09-20T17:44:30.185","100000075254","10","3","Черезшкірне застосування","Percutaneous use","ua_43_108","false",null,null,null
"109","null","null","1.0","RoutesAndMethodsOfAdministration","2023-10-10T20:55:59.276","2024-09-20T17:44:30.188","100000075255","9","3","Назогастральне застосування","Nasogastric use","ua_43_109","false",null,null,null
"110","null","null","1.0","RoutesAndMethodsOfAdministration","2023-10-10T20:55:59.280","2024-09-20T17:44:30.190","100000075256","9","3","Внутрішньошлуночкове застосування","Intraventricular use","ua_43_110","false",null,null,null
"111","null","null","1.0","RoutesAndMethodsOfAdministration","2023-10-10T20:55:59.284","2024-09-20T17:44:30.193","100000075257","8","3","Внутрішньосудинне застосування","Intravascular use","ua_43_111","false",null,null,null
"112","null","null","1.0","RoutesAndMethodsOfAdministration","2023-10-10T20:55:59.289","2024-09-20T17:44:30.196","100000075258","9","3","Інтратимпанальне застосування","Intratympanic use","ua_43_112","false",null,null,null
"113","null","null","1.0","RoutesAndMethodsOfAdministration","2023-10-10T20:55:59.293","2024-09-20T17:44:30.198","100000075259","92","1","Внутрішньолегеневе застосування","Intrapulmonary use","ua_43_113","false",null,null,"Введення лікарського засобу в легені, зазвичай шляхом ін’єкції. «Інгаляційне застосування та «Ендотрахеопульмональне застосування» виключено."
"114","null","null","1.0","RoutesAndMethodsOfAdministration","2023-10-10T20:55:59.297","2024-09-20T17:44:30.201","100000075260","90","1","Внутрішньопростатичне застосування","Intraprostatic use","ua_43_114","false",null,null,"Введення лікарського засобу в простату"
"115","null","null","1.0","RoutesAndMethodsOfAdministration","2023-10-10T20:55:59.302","2024-09-20T17:44:30.204","100000075261","11","3","Невідоме застосування","Unknown use","ua_43_115","false",null,null,null
"116","null","null","1.0","RoutesAndMethodsOfAdministration","2023-10-10T20:55:59.306","2024-09-20T17:44:30.206","100000075262","9","3","Місцеве застосування","Topical use","ua_43_116","false",null,null,null
"117","null","null","1.0","RoutesAndMethodsOfAdministration","2023-10-10T20:55:59.309","2024-09-20T17:44:30.209","100000075263","8","3","Субдермальне застосування","Subdermal use","ua_43_117","false",null,null,null
"118","null","null","1.0","RoutesAndMethodsOfAdministration","2023-10-10T20:55:59.313","2024-09-20T17:44:30.212","100000075264","91","1","Ретробульбарне застосування","Retrobulbar use","ua_43_118","false",null,null,"Введення лікарського засобу за очне яблуко"
"119","null","null","1.0","RoutesAndMethodsOfAdministration","2023-10-10T20:55:59.318","2024-09-20T17:44:30.214","100000075265","9","3","Респіраторне застосування (застосування шляхом дихання)","Respiratory use","ua_43_119","false",null,null,null
"120","null","null","1.0","RoutesAndMethodsOfAdministration","2023-10-10T20:55:59.322","2024-09-20T17:44:30.217","100000075266","11","3","Парентеральне застосування","Parenteral use","ua_43_120","false",null,null,null
"121","null","null","1.0","RoutesAndMethodsOfAdministration","2023-10-10T20:55:59.326","2024-09-20T17:44:30.219","100000075267","10","3","Інше застосування","Other use","ua_43_121","false",null,null,null
"122","null","null","1.0","RoutesAndMethodsOfAdministration","2023-10-10T20:55:59.330","2024-09-20T17:44:30.222","100000075268","10","3","Офтальмологічне застосування","Ophthalmic use","ua_43_122","false",null,null,null
"123","null","null","1.0","RoutesAndMethodsOfAdministration","2023-10-10T20:55:59.334","2024-09-20T17:44:30.224","100000075269","92","1","Іонофорез","Iontophoresis","ua_43_123","false",null,null,"Введення (іонізованих) активних речовин через непошкоджену шкіру шляхом застосування постійного електричного струму"
"124","null","null","1.0","RoutesAndMethodsOfAdministration","2023-10-10T20:55:59.338","2024-09-20T17:44:30.227","100000075270","9","3","Внутрішньовенне крапельне застосування","Intravenous drip use","ua_43_124","false",null,null,null
"125","null","null","1.0","RoutesAndMethodsOfAdministration","2023-10-10T20:55:59.342","2024-09-20T17:44:30.229","100000075271","9","3","Внутрішньовенне болюсне застосування","Intravenous bolus use","ua_43_125","false",null,null,null
"126","null","null","1.0","RoutesAndMethodsOfAdministration","2023-10-10T20:55:59.345","2024-09-20T17:44:30.233","100000075272","10","3","Внутрішньотрахеальне застосування","Intratracheal use","ua_43_126","false",null,null,null
"127","null","null","1.0","RoutesAndMethodsOfAdministration","2023-10-10T20:55:59.348","2024-09-20T17:44:30.235","100000075273","7","3","Внутрішньопечінкове застосування","Intrahepatic use","ua_43_127","false",null,null,null
"128","null","null","1.0","RoutesAndMethodsOfAdministration","2023-10-10T20:55:59.351","2024-09-20T17:44:30.238","100000075274","93","1","Інтрацистеральне застосування (для застосування у ветеринарії)","Intracisternal use","ua_43_128","false",null,null,"Введення лікарського засобу у велику цистерну."
"129","null","null","1.0","RoutesAndMethodsOfAdministration","2023-10-10T20:55:59.353","2024-09-20T17:44:30.240","100000075275","92","1","Букальне застосування","Buccal use","ua_43_129","false",null,null,"Введення лікарського засобу в щічну порожнину (мішечок, розташований між щокою і яснами) для отримання системної дії."
"130","null","null","1.0","RoutesAndMethodsOfAdministration","2023-10-10T20:55:59.356","2024-09-20T17:44:30.243","100000075276","91","1","Внутрішньохрящове застосування","Intracartilaginous use","ua_43_130","false",null,null,"Введення лікарського засобу в хрящ"
"131","null","null","1.0","RoutesAndMethodsOfAdministration","2023-10-10T20:55:59.358","2024-09-20T17:44:30.245","100000075553","102","1","При застосуванні питної води","In drinking water use","ua_43_131","false",null,null,"Введення ветеринарного лікарського засобу шляхом додавання в питну воду тварин."
"132","null","null","1.0","RoutesAndMethodsOfAdministration","2023-10-10T20:55:59.361","2024-09-20T17:44:30.248","100000075554","94","1","Субмукозне застосування (підслизове застосування)","Submucosal use","ua_43_132","false",null,null,"Ін'єкція лікарського засобу безпосередньо під слизову оболонку"
"133","null","null","1.0","RoutesAndMethodsOfAdministration","2023-10-10T20:55:59.363","2024-09-20T17:44:30.250","100000075555","6","3","Внутрішньом'язове та внутрішньовенне застосування","Intramuscular and intravenous use","ua_43_133","false",null,null,null
"134","null","null","1.0","RoutesAndMethodsOfAdministration","2023-10-10T20:55:59.365","2024-09-20T17:44:30.253","100000075556","92","1","Екстракорпоральне застосування","Extracorporeal use","ua_43_134","false",null,null,"Застосування лікарського засобу поза організмом"
"135","null","null","1.0","RoutesAndMethodsOfAdministration","2023-10-10T20:55:59.367","2024-09-20T17:44:30.255","100000075557","92","1","Періостальне застосування","Periosseous use","ua_43_135","false",null,null,"Введення лікарського засобу на кістку або навколо неї"
"136","null","null","1.0","RoutesAndMethodsOfAdministration","2023-10-10T20:55:59.370","2024-09-20T17:44:30.258","100000075558","7","3","Під'ясеневе застосування","Subgingival use","ua_43_136","false",null,null,null
