no,atc,atc_parent,vsn,model,created_on,modified_on,source_term_id,source_vsn,status,item_ua,item_en,item_code,manual,term_short_ua,term_short_en,term_desc
"1","null","null","1.0","RoutesAndMethodsOfAdministration","2023-10-10T20:55:58.925","2024-09-20T17:44:29.783","100000157797","85","1","Внутрішньогляндулярне застосування","Intraglandular use","ua_43_1","false",null,null,"Введення лікарського засобу безпосередньо в залозу, зазвичай шляхом ін’єкції. Використовувати лише там, де не застосовуються більш специфічні терміни, такі як «інтрапростатичне застосування» та «інтрамаммарне застосування»."
"2","null","null","1.0","RoutesAndMethodsOfAdministration","2023-10-10T20:55:58.937","2024-09-20T17:44:29.786","100000170084","94","1","Субретинальне застосування (введення під сітківку)","Subretinal use","ua_43_2","false",null,null,"Введення лікарського засобу між сенсорною сітківкою (нервовою сітківкою) та пігментним епітелієм сітківки ока."
"3","null","null","1.0","RoutesAndMethodsOfAdministration","2023-10-10T20:55:58.940","2024-09-20T17:44:29.788","100000170279","92","1","Інтрацеребровентрикулярне застосування","Intracerebroventricular use","ua_43_3","false",null,null,"Введення лікарського засобу в шлуночки (систему церебральних шлуночків) головного мозку."
"4","null","null","1.0","RoutesAndMethodsOfAdministration","2023-10-10T20:55:58.943","2024-09-20T17:44:29.791","100000170847","7","3","Грубе розпилення","Coarse spray","ua_43_4","false",null,null,null
"5","null","null","1.0","RoutesAndMethodsOfAdministration","2023-10-10T20:55:58.945","2024-09-20T17:44:29.797","100000155948","88","1","Інтрапортальне застосування","Intraportal use","ua_43_5","false",null,null,"Ін’єкція/інфузія лікарського засобу у ворітну вену печінки для локальної доставки в печінку."
"6","null","null","1.0","RoutesAndMethodsOfAdministration","2023-10-10T20:55:58.948","2024-09-20T17:44:29.800","100000156091","84","1","Інтрахолангіопанкреатичне застосування","Intracholangiopancreatic use","ua_43_6","false",null,null,"Ін’єкція лікарського засобу в жовчні протоки та протоки підшлункової залози, наприклад, через канюлю, введену в ампулу Фатера (загальний отвір проток), зазвичай для введення контрастної речовини для таких методів, як ендоскопічна ретроградна холангіопанкреатографія ( ЕРХПГ)."
"7","null","null","1.0","RoutesAndMethodsOfAdministration","2023-10-10T20:55:58.950","2024-09-20T17:44:29.802","100000156092","85","1","Перитуморальне застосування","Peritumoral use","ua_43_7","false",null,null,"Введення лікарського засобу безпосередньо в ділянку навколо пухлини."
"8","null","null","1.0","RoutesAndMethodsOfAdministration","2023-10-10T20:55:58.952","2024-09-20T17:44:29.824","200000010603","60","1","Інтрапутамінальне застосування (застосування всередині лушпини)","Intraputaminal use","ua_43_8","false",null,null,"Введення лікарського засобу в одну або обидві оболонки головного мозку."
"9","null","null","1.0","RoutesAndMethodsOfAdministration","2023-10-10T20:55:58.954","2024-09-20T17:44:29.827","200000010644","59","1","Трансплацентарний","Transplacental","ua_43_9","false",null,null,"Внутрішньоутробний вплив на ембріон/плід лікарського засобу, який вводили вагітній матері."
"10","null","null","1.0","RoutesAndMethodsOfAdministration","2023-10-10T20:55:58.956","2024-09-20T17:44:29.830","200000010643","62","1","Місцеве","Topical","ua_43_10","false",null,null,"Введення лікарського засобу невизначеним шляхом, включаючи застосування на шкірі або слизовій, за винятком перорального та парентерального введення. Цей термін слід використовувати лише у разі, коли неможливо визначити один конкретний шлях введення (наприклад, «шкірне застосування»)."
"11","null","null","1.0","RoutesAndMethodsOfAdministration","2023-10-10T20:55:58.959","2024-09-20T17:44:29.833","200000010645","58","1","Внутрішньовим'янний","Transmammary","ua_43_11","false",null,null,"Вплив лікарського засобу на немовля на грудному вигодовуванні, що вводиться матері, яка годує груддю."
"12","null","null","1.0","RoutesAndMethodsOfAdministration","2023-10-10T20:55:58.961","2024-09-20T17:44:29.836","200000012510","7","3","Інстиляція","Instillation","ua_43_12","false",null,null,null
"13","null","null","1.0","RoutesAndMethodsOfAdministration","2023-10-10T20:55:58.964","2024-09-20T17:44:29.840","100000073564","87","1","Аурикулярне застосування (Вушне застосування)","Auricular use","ua_43_13","false",null,null,"Введення лікарського засобу у вухо."
"14","null","null","1.0","RoutesAndMethodsOfAdministration","2023-10-10T20:55:58.967","2024-09-20T17:44:29.844","100000073565","84","1","Занурювання дзьоба","Beak dipping","ua_43_14","false",null,null,"Введення ветеринарного лікарського засобу шляхом занурення дзьоба птахів у водний розчин лікарського засобу."
"15","null","null","1.0","RoutesAndMethodsOfAdministration","2023-10-10T20:55:58.970","2024-09-20T17:44:29.848","100000073566","88","1","Нашкірне застосування","Cutaneous use","ua_43_15","false",null,null,"Нанесення лікарського засобу на шкіру та/або шкірні рани та/або нігті та/або волосся з метою отримання місцевого ефекту."
"16","null","null","1.0","RoutesAndMethodsOfAdministration","2023-10-10T20:55:58.973","2024-09-20T17:44:29.853","100000073567","85","1","Застосування у стоматології","Dental use","ua_43_16","false",null,null,"Введення лікарського засобу до та/або в зуби або, на та/або навколо нервів, що живлять зуби."
"17","null","null","1.0","RoutesAndMethodsOfAdministration","2023-10-10T20:55:58.976","2024-09-20T17:44:29.857","100000073568","85","1","Занурення","Dipping","ua_43_17","false",null,null,"Введення ветеринарного лікарського засобу шляхом занурення тварини у ванну або глибоководний басейн, що містить лікарський засіб."
"18","null","null","1.0","RoutesAndMethodsOfAdministration","2023-10-10T20:55:58.980","2024-09-20T17:44:29.862","100000073569","86","1","Ендоцервікальне застосування","Endocervical use","ua_43_18","false",null,null,"Введення лікарського засобу в шийку матки."
"19","null","null","1.0","RoutesAndMethodsOfAdministration","2023-10-10T20:55:58.983","2024-09-20T17:44:29.866","100000073570","86","1","Ендосинусіальне застосування","Endosinusial use","ua_43_19","false",null,null,"Введення лікарського засобу в носові пазухи для отримання місцевого ефекту."
"20","null","null","1.0","RoutesAndMethodsOfAdministration","2023-10-10T20:55:58.987","2024-09-20T17:44:29.871","100000073571","89","1","Ендотрахеопульмональне застосування","Endotracheopulmonary use","ua_43_20","false",null,null,"Введення лікарського засобу в трахею та/або бронхи шляхом інстиляції (виключаються препарати для інгаляцій; див. застосування для інгаляцій)."
"21","null","null","1.0","RoutesAndMethodsOfAdministration","2023-10-10T20:55:58.990","2024-09-20T17:44:29.876","100000073572","84","1","Епідуральне застосування","Epidural use","ua_43_21","false",null,null,"Ін'єкція лікарського засобу в епідуральний простір."
"22","null","null","1.0","RoutesAndMethodsOfAdministration","2023-10-10T20:55:58.994","2024-09-20T17:44:29.881","100000073573","85","1","Епілезійне застосування","Epilesional use","ua_43_22","false",null,null,"Нанесення лікарського засобу на вогнище ураження."
"23","null","null","1.0","RoutesAndMethodsOfAdministration","2023-10-10T20:55:58.997","2024-09-20T17:44:29.886","100000073574","85","1","Екстраамніотичне застосування","Extraamniotic use","ua_43_23","false",null,null,"Ін'єкція лікарського засобу між хоріоном і амніоном."
"24","null","null","1.0","RoutesAndMethodsOfAdministration","2023-10-10T20:55:59.001","2024-09-20T17:44:29.891","100000073575","84","1","Введення у лапу птахів","Foot-stab use","ua_43_24","false",null,null,"Введення ветеринарного препарату у лапу птахів."
"25","null","null","1.0","RoutesAndMethodsOfAdministration","2023-10-10T20:55:59.004","2024-09-20T17:44:29.896","100000073576","86","1","Гастроентеральне застосування","Gastroenteral use","ua_43_25","false",null,null,"Введення лікарського засобу в шлунково-кишковий тракт за допомогою відповідного пристрою. Застосовувати лише у випадках, інших ніж шлункове застосування та застосування в кишечнику."
"26","null","null","1.0","RoutesAndMethodsOfAdministration","2023-10-10T20:55:59.008","2024-09-20T17:44:29.901","100000073577","86","1","Шлункове застосування","Gastric use","ua_43_26","false",null,null,"Введення лікарського засобу в шлунок за допомогою відповідного пристрою"
"27","null","null","1.0","RoutesAndMethodsOfAdministration","2023-10-10T20:55:59.012","2024-09-20T17:44:29.907","100000073578","84","1","Гінгівальне застосування","Gingival use","ua_43_27","false",null,null,"Введення лікарського засобу в ясна."
"28","null","null","1.0","RoutesAndMethodsOfAdministration","2023-10-10T20:55:59.016","2024-09-20T17:44:29.911","100000073579","86","1","Гемодіаліз","Haemodialysis","ua_43_28","false",null,null,"Очищення крові за допомогою напівпроникної мембрани. [Попередній англійський термін «Гемодіаліз» виправлено 04/07/11.]"
"29","null","null","1.0","RoutesAndMethodsOfAdministration","2023-10-10T20:55:59.020","2024-09-20T17:44:29.915","100000073580","94","1","У питній воді/молоці","In drinking water/milk use","ua_43_29","false",null,null,"Введення ветеринарного лікарського засобу шляхом додавання тварині в питну воду, молоко або замінник молока. [Попередній англійський термін «У питній воді або вживанні молока» виправлено 28/03/2011.]"
"30","null","null","1.0","RoutesAndMethodsOfAdministration","2023-10-10T20:55:59.024","2024-09-20T17:44:29.920","100000073581","85","1","In ovo застосування","In ovo","ua_43_30","false",null,null,"Введення ветеринарного лікарського засобу через шкаралупу в зародкове яйце."
"31","null","null","1.0","RoutesAndMethodsOfAdministration","2023-10-10T20:55:59.028","2024-09-20T17:44:29.924","100000073582","84","1","Введення шляхом додавання в корм","In-feed use","ua_43_31","false",null,null,"Введення ветеринарного препарату шляхом додавання в корм тваринам."
"32","null","null","1.0","RoutesAndMethodsOfAdministration","2023-10-10T20:55:59.031","2024-09-20T17:44:29.929","100000073583","86","1","Застосування у вулику","In-hive use","ua_43_32","false",null,null,"Введення ветеринарного лікарського засобу у бджолиний вулик, наприклад, шляхом розміщення його у бджолиному вулику, розбризкування над чи у бджолиному вулику або перетворення його на пару за допомогою відповідного пристрою для випаровування, щоб пари потрапили в бджолиний вулик."
"33","null","null","1.0","RoutesAndMethodsOfAdministration","2023-10-10T20:55:59.035","2024-09-20T17:44:29.933","100000073584","90","1","Інгаляційне застосування","Inhalation use","ua_43_33","false",null,null,"Введення лікарського засобу в дихальну систему шляхом інгаляції для отримання системної або місцевої дії в нижніх дихальних шляхах. Назальне та ендотрахеопульмональне застосування виключено"
"34","null","null","1.0","RoutesAndMethodsOfAdministration","2023-10-10T20:55:59.039","2024-09-20T17:44:29.937","100000073585","86","1","Застосування в кишечнику","Intestinal use","ua_43_34","false",null,null,"Введення лікарського засобу в кишечник (дванадцятипалу кишку, порожню кишку, клубову та ободову кишку) за допомогою відповідного пристрою. Шлунково-кишкове застосування виключено"
"35","null","null","1.0","RoutesAndMethodsOfAdministration","2023-10-10T20:55:59.043","2024-09-20T17:44:29.941","100000073586","85","1","Інтраамніотичне застосування","Intraamniotic use","ua_43_35","false",null,null,"Ін'єкція лікарського засобу в амніотичну порожнину."
"36","null","null","1.0","RoutesAndMethodsOfAdministration","2023-10-10T20:55:59.046","2024-09-20T17:44:29.946","100000073587","86","1","Внутрішньоартеріальне застосування","Intraarterial use","ua_43_36","false",null,null,"Ін'єкція лікарського засобу в артерію."
"37","null","null","1.0","RoutesAndMethodsOfAdministration","2023-10-10T20:55:59.050","2024-09-20T17:44:29.950","100000073588","87","1","Внутрішньосуглобове застосування","Intraarticular use","ua_43_37","false",null,null,"Ін'єкція лікарського засобу в суглобову порожнину."
"38","null","null","1.0","RoutesAndMethodsOfAdministration","2023-10-10T20:55:59.054","2024-09-20T17:44:29.954","100000073589","87","1","Інтрабурсальне застосування","Intrabursal use","ua_43_38","false",null,null,"Ін'єкція лікарського засобу в бурси і сухожилля."
"39","null","null","1.0","RoutesAndMethodsOfAdministration","2023-10-10T20:55:59.057","2024-09-20T17:44:29.958","100000073590","85","1","Внутрішньосерцеве застосування","Intracardiac use","ua_43_39","false",null,null,"Ін'єкція лікарського засобу в серцевий м'яз та/або порожнину серця."
"40","null","null","1.0","RoutesAndMethodsOfAdministration","2023-10-10T20:55:59.060","2024-09-20T17:44:29.963","100000073591","84","1","Інтракавернозне застосування","Intracavernous use","ua_43_40","false",null,null,"Ін'єкція лікарського засобу в кавернозне тіло."
"41","null","null","1.0","RoutesAndMethodsOfAdministration","2023-10-10T20:55:59.064","2024-09-20T17:44:29.967","100000073592","87","1","Інтрацеребральне застосування","Intracerebral use","ua_43_41","false",null,null,"Введення лікарського засобу безпосередньо в тканину мозку. Цей термін використовується лише тоді, коли більш специфічний термін (наприклад, «інтрапутамінальне введення») не застосовується."
"42","null","null","1.0","RoutesAndMethodsOfAdministration","2023-10-10T20:55:59.067","2024-09-20T17:44:29.970","100000073593","84","1","Інтрацервікальне застосування","Intracervical use","ua_43_42","false",null,null,"Ін'єкція лікарського засобу в шийку матки."
"43","null","null","1.0","RoutesAndMethodsOfAdministration","2023-10-10T20:55:59.071","2024-09-20T17:44:29.974","100000073594","85","1","Внутрішньокоронарне застосування","Intracoronary use","ua_43_43","false",null,null,"Ін'єкція лікарського засобу в коронарну артерію."
"44","null","null","1.0","RoutesAndMethodsOfAdministration","2023-10-10T20:55:59.074","2024-09-20T17:44:29.978","100000073595","87","1","Внутрішньошкірне застосування","Intradermal use","ua_43_44","false",null,null,"Ін'єкція лікарського засобу в дерму."
"45","null","null","1.0","RoutesAndMethodsOfAdministration","2023-10-10T20:55:59.078","2024-09-20T17:44:29.982","100000073596","86","1","Внутрішньодискове застосування","Intradiscal use","ua_43_45","false",null,null,"Ін'єкція лікарського засобу в пульпозне ядро міжхребцевого диска."
"46","null","null","1.0","RoutesAndMethodsOfAdministration","2023-10-10T20:55:59.081","2024-09-20T17:44:29.985","100000073597","86","1","Інтралезійне застосування","Intralesional use (","ua_43_46","false",null,null,"Введення лікарського засобу за допомогою ін’єкцій або будь-яким іншим способом безпосередньо в вогнище ураження."
"47","null","null","1.0","RoutesAndMethodsOfAdministration","2023-10-10T20:55:59.085","2024-09-20T17:44:29.989","100000073598","85","1","Інтралімфатичне застосування","Intralymphatic use","ua_43_47","false",null,null,"Ін'єкція лікарського засобу в лімфатичну судину."
"48","null","null","1.0","RoutesAndMethodsOfAdministration","2023-10-10T20:55:59.088","2024-09-20T17:44:29.992","100000073599","93","1","Інтрамамарне застосування","Intramammary use","ua_43_48","false",null,null,"Введення ветеринарного лікарського засобу в інтрамаммарну залозу через сосковий канал."
"49","null","null","1.0","RoutesAndMethodsOfAdministration","2023-10-10T20:55:59.092","2024-09-20T17:44:29.995","100000073600","96","1","Внутрішньом'язове застосування","Intramuscular use","ua_43_49","false",null,null,"Ін'єкція лікарського засобу в м'язову тканину."
"50","null","null","1.0","RoutesAndMethodsOfAdministration","2023-10-10T20:55:59.095","2024-09-20T17:44:29.999","100000073601","87","1","Інтраокулярне застосування (внутрішньоочне застосування)","Intraocular use","ua_43_50","false",null,null,"Введення лікарського засобу в око. Термін «внутрішньоочне застосування» призначений лише для використання, коли більш специфічний термін (наприклад, «внутрішньокамерне застосування», «інтравітреальне застосування») не застосовується. Окулярне та субкон’юнктивальне застосування виключено."
"51","null","null","1.0","RoutesAndMethodsOfAdministration","2023-10-10T20:55:59.099","2024-09-20T17:44:30.002","100000073602","89","1","Внутрішньокісткове застосування","Intraosseous use","ua_43_51","false",null,null,"Введення лікарського засобу в кістковий мозок. Інтрастернальне застосування виключено."
"52","null","null","1.0","RoutesAndMethodsOfAdministration","2023-10-10T20:55:59.102","2024-09-20T17:44:30.005","100000073603","85","1","Інтраперикардіальне застосування","Intrapericardial use","ua_43_52","false",null,null,"Ін'єкція лікарського засобу в перикард."
"53","null","null","1.0","RoutesAndMethodsOfAdministration","2023-10-10T20:55:59.106","2024-09-20T17:44:30.008","100000073604","86","1","Внутрішньоочеревинне застосування","Intraperitoneal use","ua_43_53","false",null,null,"Ін'єкція лікарського засобу в черевну порожнину."
"54","null","null","1.0","RoutesAndMethodsOfAdministration","2023-10-10T20:55:59.110","2024-09-20T17:44:30.011","100000073605","87","1","Внутрішньоплевральне застосування","Intrapleural use","ua_43_54","false",null,null,"Ін'єкція лікарського засобу в плевральну порожнину."
"55","null","null","1.0","RoutesAndMethodsOfAdministration","2023-10-10T20:55:59.116","2024-09-20T17:44:30.014","100000073606","87","1","Інтрарумінальне застосування (введення до рубця (шлунка) жуйних тварин)","Intraruminal use","ua_43_55","false",null,null,"Введення ветеринарного лікарського засобу до рубця (шлунка) жуйних тварин"
"56","null","null","1.0","RoutesAndMethodsOfAdministration","2023-10-10T20:55:59.119","2024-09-20T17:44:30.017","100000073607","86","1","Інтрастернальне застосування","Intrasternal use","ua_43_56","false",null,null,"Ін'єкція лікарського засобу в кістковий мозок грудини."
"57","null","null","1.0","RoutesAndMethodsOfAdministration","2023-10-10T20:55:59.124","2024-09-20T17:44:30.020","100000073608","87","1","Інтратекальне застосування","Intrathecal use","ua_43_57","false",null,null,"Ін'єкція лікарського засобу через тверду мозкову оболонку в субарахноїдальну порожнину."
"58","null","null","1.0","RoutesAndMethodsOfAdministration","2023-10-10T20:55:59.128","2024-09-20T17:44:30.022","100000073609","87","1","Внутрішньопухлинне застосування","Intratumoral use","ua_43_58","false",null,null,"Ін'єкція лікарського засобу в пухлину."
"59","null","null","1.0","RoutesAndMethodsOfAdministration","2023-10-10T20:55:59.132","2024-09-20T17:44:30.025","100000073610","86","1","Внутрішньоматкове застосування","Intrauterine use","ua_43_59","false",null,null,"Введення лікарського засобу в порожнину матки."
"60","null","null","1.0","RoutesAndMethodsOfAdministration","2023-10-10T20:55:59.136","2024-09-20T17:44:30.028","100000073611","105","1","Внутрішньовенне застосування","Intravenous use","ua_43_60","false",null,null,"Ін'єкція лікарського засобу у вену."
"61","null","null","1.0","RoutesAndMethodsOfAdministration","2023-10-10T20:55:59.139","2024-09-20T17:44:30.031","100000073612","84","1","Внутрішньоміхурове застосування","Intravesical use","ua_43_61","false",null,null,"Введення лікарського засобу в сечовий міхур."
"62","null","null","1.0","RoutesAndMethodsOfAdministration","2023-10-10T20:55:59.142","2024-09-20T17:44:30.033","100000073613","87","1","Інтравітреальне застосування","Intravitreal use","ua_43_62","false",null,null,"Введення лікарського засобу в задню камеру ока."
