no,atc,atc_parent,vsn,model,created_on,modified_on,source_term_id,source_vsn,status,item_ua,item_en,item_code,manual,term_short_ua,term_short_en,term_desc
"1","null","null","1.0","XEVMPDMedicinalProductType","2023-10-13T16:06:04.996","2024-09-23T10:40:40.752","200000003511","2","1","Лікарський засіб, що паралельно розповсюджується/імпортується (стаття 76(3) і (4) Директиви 2001/83/ЄC)","Parallel Distributed/Imported medicinal product (Article 76(3) and (4) of Directive No 2001/83/EC)","ua_58_1","false",null,null,null
"2","null","null","1.0","XEVMPDMedicinalProductType","2023-10-13T16:06:04.999","2024-09-23T10:40:40.757","200000003512","2","1","Торгова ліцензія за виняткових обставин (стаття 14(6)(8) Регламенту (ЄС) 726/2004 або стаття 22 Директиви 2001/83/ЄC)","Exceptional Circumstances Marketing Authorisation (Article 14(6) (8) of Regulation (EC) No 726/2004 or Article 22 of Directive 2001/83/EC)","ua_58_2","false",null,null,null
"3","null","null","1.0","XEVMPDMedicinalProductType","2023-10-13T16:06:05","2024-09-23T10:40:40.762","200000003513","2","1","Ліцензований гомеопатичний лікарський засіб","Authorised homeopathic medicinal product","ua_58_3","false",null,null,null
"4","null","null","1.0","XEVMPDMedicinalProductType","2023-10-13T16:06:05.002","2024-09-23T10:40:40.767","200000003514","2","1","Ліцензований рослинний лікарський засіб","Authorised herbal medicinal product","ua_58_4","false",null,null,null
"5","null","null","1.0","XEVMPDMedicinalProductType","2023-10-13T16:06:05.003","2024-09-23T10:40:40.772","200000003515","4","1","Торгова ліцензія для педіатричного застосування (PUMA) (стаття 30 Регламенту (ЄС) 1901/2006)","Paediatric Use Marketing Authorisation (PUMA) (Article 30 of Regulation (EC) No 1901/2006)","ua_58_5","false",null,null,null
"6","null","null","1.0","XEVMPDMedicinalProductType","2023-10-13T16:06:05.005","2024-09-23T10:40:40.778","200000003516","2","1","Умовна торгова ліцензія (стаття 14(7) Регламенту (ЄС) 726/2004)","Conditional Marketing Authorisation (Article 14 (7) of Regulation (EC) No 726/2004)","ua_58_6","false",null,null,null
"7","null","null","1.0","XEVMPDMedicinalProductType","2023-10-13T16:06:05.006","2024-09-23T10:40:40.783","200000003517","2","1","Інше","Other","ua_58_7","false",null,null,null
